6/6/2023 22:04:38,MetaDrive,"Rachel Clinton, Anais Marroquin, Mike Yang, Eric Zhang",CS210,"MetaDrive, composed of Stanford students Rachel Clinton, Anais Marroquin, Mike Yang, and Eric Zhang, has partnered with BMW to reimagine the digital conferencing experience for drivers and passengers of vehicles. We utilize NReal AR glasses to enable users to participate in a safe and immersive digital meeting experience while on the road.

Our meeting platform, which is designed in Unity, contains the following features: joining a virtual meeting, sharing screen, taking meeting notes using typing or voice recording, button clicking with hand gestures, and switching modes between the driver mode (a version with restricted functionality) and the passenger mode (the full version). 

We are excited to share our work with you!"
6/6/2023 23:15:27,xTen,"Ruslan Al-Jabari, Ashna Khetan, Ishita Mangla, Noel Sarduy",CS210,"Build a browser extension in minutes.
xTen is a package that enables developers to create cross-platform browser extensions powered by AI. The toolkit provides an extensible architecture for integrating AI APIs, simplifying the development process and offering advanced features such as intelligent web scraping, code + UI injection, and AI-powered data processing."
6/6/2023 23:57:44,Team SOAR,"Ali Shah, Anthony Qin, Benjamin Wittenbrink, Rohan Mehrotra, Sonny Young",CS210,"SOAR is an augmented reality (AR) navigation and social annotation app designed specifically for drivers. With its AR overlays, the app provides a hands-free navigation experience, allowing drivers to follow directions effortlessly while staying focused on the road. Additionally, SOAR enables users to explore and save points of interest (POIs) suggested by their friends, enhancing the social aspect of driving. Users can also contribute their own POIs, fostering a collaborative driving experience. Our prototypes have been developed on platforms such as Oculus in virtual reality (VR), NReal AR glasses, and Android for object detection. The primary goal of SOAR is to enhance driver comfort, entertainment, and safety, while promoting a connected driving community."
6/9/2023 11:21:08,Slingshot,"Flynn Traeger, Bryn Hughes, Moe Khalil, Porter Weisberg",CS210,"Slingshot is a collaborative workflow management platform that leverages existing datasets to make a company's knowledge base accessible to all teams with granular control.

We are building a platform to allow researchers, engineers, analysts, and managers at all levels of an organisation to have their questions answered faster, using LLMs to tie these answers to their source-of-truth documents, and building their workflows right into our platform to create the rails for a company's collaborative efforts that are focused on innovating based on these documents.

We seek to produce exponential knowledge for our partners as the insights they generate using Slingshot will be accrued in the source-of-truth for future teams to benefit from and integrate into their workflows in our platform."
6/9/2023 13:59:25,rizzGPT,bryan chiang,CS191,charisma-as-a-service (CaaS) using generative AI and large language models.
6/9/2023 15:20:15,PodSquad,"Abhay Singhal, Daniel Ma, Jack Yuan, Niral Patel",CS194 or CS194W,"PodGPT is an all-in-one chatbot to talk to documents, podcasts, videos, news articles, and websites"
6/9/2023 15:23:26,InteractADL,Edward Vendrow,CS191,"Recognizing human activities has recently been a central focus in video understanding for different applications. Specifically for assistive robots, smart homes, or healthcare applications, understanding activities of daily living (ADLs) is an integral component. However, to date, few benchmarks and methods have focused on complex ADLs, especially those involving multi-person interactions. We propose a new dataset and benchmark called InteractAD for understanding complex ADLs that involve interaction between humans (and objects). Our multi-modal (11 modalities) and multi-view (ego and multiple third-person views) dataset is annotated with human-human interactions, beyond human-object relationships considered by the prior work, as well as hierarchical activity labels for each individual in the scene."
6/9/2023 17:52:19,BeYoked,"AJ Arnolie, Ava Stills, Devin Green, Joseph Ngo, Lorenzo Ahn",CS194 or CS194W,"BeYoked is a social media and workout-tracking app which allows users to post photos of their workouts, track their fitness progress by creating personal goals, and connect with other people interested in fitness through the app's online community. "
6/9/2023 19:14:37,BunnyHabit,"Eric Bear, Murtaza Hassan, Kyle Nguyen, Andre Saunders, Liz Sinyavin",CS194 or CS194W,BunnyHabit is a community-driven habit tracking app where users and their friends can update each other on the progress of their individual and shared goals.
6/9/2023 20:36:58,Sentinel,"Nathan Bhak, Jessica Yu, Kai Kato, Gautam Akiwate (advisor)",CS191,"The “Sentinel Project” aims to protect users, organizations, and certificate authorities (CAs) against demonstrated real-world hijacking domain attacks by building and deploying a global monitoring system to collect domain-related data immediately following certificate issuance."
6/9/2023 22:18:53,SuperHF: Supervised Iterative Learning from Human Feedback,Gabriel Mukobi,CS191,"Ensuring safety and human value alignment in foundation models (FMs) is increasingly important. Supervised Fine-Tuning (SFT) offers simplicity and robustness, while Reinforcement Learning from Human Feedback (RLHF) yields state-of-the-art results but suffers from instability and reward hacking. We propose Supervised Iterative Learning from Human Feedback (SuperHF), a method combining the best of both approaches. SuperHF focuses on the reward model's importance in RLHF for data efficiency and generalization while replacing Proximal Policy Optimization (PPO) with a simpler supervised loss and a KL divergence prior.

We split our evaluation criteria into robust optimization of the reward while also avoiding reward hacking. For the former, SuperHF beats other training methods on the reward objective. For the latter, we conduct qualitative ratings by GPT-4 to find SuperHF outperforms RLHF in terms of reward, stability, robustness across hyperparameters, and reducing reward hacking."
6/9/2023 23:48:35,Rizzcipe,"Andrew Gan, Constance Horng, David Liu, Grace Zhang",CS194 or CS194W,"After a long day, the last thing people want to do is stress over what to cook with the items in their fridge. There are other online tools that generate recipes from the ingredients you have, but they still make you manually check off everything in your fridge, which becomes a huge hassle.

Introducing Rizzcipe -- a mobile app that takes all the effort out of meal planning. Just snap a pic of your fridge, and bam! Rizzcipe knows what's in there and suggests recipes that fit the bill. It's like having a genius chef right in your pocket, powered by cutting edge machine learning technology."
6/10/2023 1:01:59,Matthew Kolodner,Matthew Kolodner,CS191,"Despite the wide availability of remote sensing imagery, deep learning continues to be bottle-necked in this space by the lack labeled data. We explore using active learning to address this need, adapting modern active learning approaches to the structure of remote sensing data. First, we improve upon ”cold-start” active learning, which assumes no initial label pool, by using SatMAE, a self-supervised vision transformer, with ProbCover, a state-of-the-art active learning algorithm. Next, we improve on ”warm-start” active learning approaches, which require an initial label pool, by incorporating geographical information with the margin and entropy sampling techniques. We showcase strong results for each domain, demonstrating the use case of active learning in this space. "
6/10/2023 1:09:13,Improving Active Learning for Remote Sensing Datasets,"Matthew Kolodner, Senem Isik, Amol Singh, Jake Silberg, Jeremy Irvin",CS191,"Despite the wide availability of remote sensing imagery, deep learning continues to be bottle-necked in this space by the lack of labeled data. We explore using active learning to address this need, adapting modern active learning approaches to the structure of remote sensing data. First, we improve upon ""cold-start"" active learning, which assumes no initial label pool, by using SatMAE, a self-supervised vision transformer, with ProbCover, a state-of-the-art active learning algorithm. Next, we improve on ""warm-start"" active learning approaches, which require an initial label pool, by incorporating geographical information with the margin and entropy sampling techniques. For each domain, we achieve strong performance, demonstrating the use case of geospatial information with self-supervised active learning approaches for remote sensing tasks."
6/10/2023 1:47:09,A Plot in the Dark,"Miranda Diaz, Jasmine Steele, Ember Fu",CS191,"A Plot in the Dark is an online party game that tests how well you know your friends—and how well your friends know you! Our game supports up to four players and consists of three rounds. During each round, you will plot everyone (including yourself!) on a cartesian plane using a variety of wacky prompts to guide your placements. You can feel free to answer honestly as there are no winners or losers in this game, only data! Once all players’ placements are collected, you will get to see each player’s average placement, as well as where everyone individually placed them. After the three rounds, special titles are awarded based on each player's results and how their responses compare to the others’!"